{
  "id": "SCL_ASFnNRSBeT7Y-cancel-turn-8",
  "suite": "cancel",
  "source": "livekit-trace",
  "traceId": "SCL_ASFnNRSBeT7Y",
  "tags": [
    "cancel",
    "needs-review"
  ],
  "context": {
    "trunkPhone": "+13523202007",
    "phoneLookupStatus": "unknown",
    "notes": "Real call: agent cancelled an appointment. Check that cancel_appt was actually called rather than just verbally agreed."
  },
  "conversation": [
    {
      "role": "assistant",
      "content": "Thank you for calling Eye Radiance powered by Abeeta Eye Group. How can I help you?"
    },
    {
      "role": "user",
      "content": "Reschedule appointment."
    },
    {
      "role": "assistant",
      "content": "Can I get your first name?"
    },
    {
      "role": "user",
      "content": "Tanya."
    },
    {
      "role": "assistant",
      "content": "Hey Tanya, I see you have an appointment today at four thirty p m with Dr. Licht.  What day would you like to reschedule to?"
    },
    {
      "role": "user",
      "content": "Next Monday."
    },
    {
      "role": "assistant",
      "content": "That would be Monday, April 27th.  What time works for you?"
    },
    {
      "role": "user",
      "content": "9:15."
    },
    {
      "role": "assistant",
      "content": "I don't have anything at nine fifteen a m on Monday.  The earliest I have is Tuesday, April 28th at five p m with Dr. Licht.  Would that work?"
    },
    {
      "role": "user",
      "content": "What else do you have?"
    },
    {
      "role": "assistant",
      "content": "I also have five thirty p m on Tuesday, April 28th with Dr. Licht.  Would either of those work for you?"
    },
    {
      "role": "user",
      "content": "What else do you have?"
    },
    {
      "role": "assistant",
      "content": "Those are the only two openings I have next week.  Would you like one of those, or would you prefer a different week?"
    },
    {
      "role": "user",
      "content": "Tuesday at 5."
    }
  ],
  "expectations": {
    "mustCallTools": [
      "cancel_appt"
    ],
    "mustNotCallTools": [],
    "policyFlags": [
      "cancel_requires_tool_call"
    ],
    "styleFlags": [
      "concise"
    ]
  }
}
