{
  "id": "SCL_4WF3jmQAB24p-verify-turn-6",
  "suite": "verification",
  "source": "livekit-trace",
  "traceId": "SCL_4WF3jmQAB24p",
  "tags": [
    "verification",
    "needs-review"
  ],
  "context": {
    "trunkPhone": "+17275919997",
    "phoneLookupStatus": "unknown",
    "notes": "Real call: agent re-ran verify_patient. Check whether retry was necessary or wasteful."
  },
  "conversation": [
    {
      "role": "assistant",
      "content": "thank you for calling Abita Eye Group, this is David, how can I help you?"
    },
    {
      "role": "user",
      "content": "Yes, uh, uh, David, uh— I'm calling on behalf of, uh— Simone Sherry—"
    },
    {
      "role": "assistant",
      "content": "ok, and have you been seen here"
    },
    {
      "role": "user",
      "content": "Um, she was at the— yeah."
    },
    {
      "role": "assistant",
      "content": "alright, let me pull up her record.  Can I get her first name and date of birth?"
    },
    {
      "role": "user",
      "content": "No. Okay, the first name is Simone, S-I-M-O-N-E. Last name is Sherry— C-H-E-R-Y— And date of birth is February— February 8th."
    },
    {
      "role": "assistant",
      "content": "and what year was she born?"
    },
    {
      "role": "user",
      "content": "19— Thank you. 1968—"
    },
    {
      "role": "assistant",
      "content": "alright, let me try that again -- could you spell the last name for me one more time?"
    },
    {
      "role": "user",
      "content": "C-H-E-R-Y."
    }
  ],
  "expectations": {
    "mustCallTools": [
      "verify_patient"
    ],
    "mustNotCallTools": [],
    "policyFlags": [],
    "styleFlags": [
      "concise"
    ]
  }
}
