{
  "id": "SCL_SuBHD4wHb7kz-transfer-turn-3",
  "suite": "transfer",
  "source": "livekit-trace",
  "traceId": "SCL_SuBHD4wHb7kz",
  "tags": [
    "transfer",
    "human-request",
    "needs-review"
  ],
  "context": {
    "trunkPhone": "+17275919997",
    "phoneLookupStatus": "unknown",
    "notes": "Extracted from a call that transferred to a human."
  },
  "conversation": [
    {
      "role": "assistant",
      "content": "thank you for calling Abita Eye Group, this is David, how can I help you?"
    },
    {
      "role": "user",
      "content": "Speak to a person—"
    },
    {
      "role": "assistant",
      "content": "I can help you right here.  What are you calling about?"
    },
    {
      "role": "user",
      "content": "Take— Speak to a person."
    }
  ],
  "expectations": {
    "mustCallTools": [
      "transfer_call"
    ],
    "mustNotCallTools": [],
    "policyFlags": [
      "caller_requested_human",
      "no_second_pushback",
      "speak_full_transfer_message_before_call"
    ],
    "styleFlags": []
  }
}
