{
  "id": "SCL_qmjbscfu9cqV-transfer-turn-4",
  "suite": "transfer",
  "source": "livekit-trace",
  "traceId": "SCL_qmjbscfu9cqV",
  "tags": [
    "transfer",
    "human-request",
    "needs-review"
  ],
  "context": {
    "trunkPhone": "+17275919997",
    "phoneLookupStatus": "unknown",
    "notes": "Extracted from a call that transferred to a human."
  },
  "conversation": [
    {
      "role": "assistant",
      "content": "thank you for calling Abita Eye Group, this is David, how can I help you?"
    },
    {
      "role": "user",
      "content": "I need to speak— to somebody regarding a patient— Um— Phone number?"
    },
    {
      "role": "assistant",
      "content": "yeah I can help with that.  What's the patient's name?"
    },
    {
      "role": "user",
      "content": "Bulgarian—"
    },
    {
      "role": "assistant",
      "content": "ok, and what's the last name?"
    },
    {
      "role": "user",
      "content": "Can I speak to a representative, please?"
    }
  ],
  "expectations": {
    "mustCallTools": [
      "transfer_call"
    ],
    "mustNotCallTools": [],
    "policyFlags": [
      "caller_requested_human",
      "speak_full_transfer_message_before_call"
    ],
    "styleFlags": []
  }
}
