{
  "id": "transfer-first-human-pushback-001",
  "suite": "transfer",
  "source": "seed",
  "tags": ["transfer", "human-request", "pushback"],
  "context": {
    "trunkPhone": "+17275919997",
    "phoneLookupStatus": "verified",
    "notes": "First time the caller asks for a human without naming anyone — agent should ask what they're calling about (one pushback). Do NOT transfer yet."
  },
  "conversation": [
    {
      "role": "assistant",
      "content": "thank you for calling Abita Eye Group, this is David, how can I help you?"
    },
    {
      "role": "user",
      "content": "Can I talk to a real person?"
    }
  ],
  "expectations": {
    "mustCallTools": [],
    "mustNotCallTools": ["transfer_call"],
    "mustSay": ["calling about"],
    "policyFlags": ["one_pushback_before_transfer_for_unspecified_human_request"],
    "styleFlags": ["brief"]
  }
}
