{
  "id": "SCL_Gtqp6f2yqZqM-quick-question-turn-3",
  "suite": "quick-question",
  "source": "livekit-trace",
  "traceId": "SCL_Gtqp6f2yqZqM",
  "tags": [
    "quick-question",
    "knowledge",
    "needs-review"
  ],
  "context": {
    "trunkPhone": "+17275919997",
    "phoneLookupStatus": "unknown",
    "notes": "Real call: agent looked up knowledge for a question. Check answer was grounded in lookup result, not invented."
  },
  "conversation": [
    {
      "role": "assistant",
      "content": "thank you for calling Abita Eye Group, this is David, how can I help you?"
    },
    {
      "role": "user",
      "content": "I was calling about the Spring Hill location."
    },
    {
      "role": "assistant",
      "content": "yeah I can help with that.  What were you needing to know about the Spring Hill location?"
    },
    {
      "role": "user",
      "content": "Is there a pediatric ophthalmologist there?"
    }
  ],
  "expectations": {
    "mustCallTools": [
      "lookup_knowledge"
    ],
    "mustNotCallTools": [],
    "policyFlags": [],
    "styleFlags": [
      "concise"
    ]
  }
}
