{
  "id": "SCL_iPfoQU5ZQrXt-quick-question-turn-4",
  "suite": "quick-question",
  "source": "livekit-trace",
  "traceId": "SCL_iPfoQU5ZQrXt",
  "tags": [
    "quick-question",
    "knowledge",
    "needs-review"
  ],
  "context": {
    "trunkPhone": "+17275919997",
    "phoneLookupStatus": "unknown",
    "notes": "Real call: agent looked up knowledge for a question. Check answer was grounded in lookup result, not invented."
  },
  "conversation": [
    {
      "role": "assistant",
      "content": "thank you for calling Abita Eye Group, this is David, how can I help you?"
    },
    {
      "role": "user",
      "content": "Tax number—"
    },
    {
      "role": "assistant",
      "content": "can I get your first name?"
    },
    {
      "role": "user",
      "content": "Alicia?"
    },
    {
      "role": "assistant",
      "content": "hey Alicia, what can I do for you today?"
    },
    {
      "role": "user",
      "content": "Fax number?"
    }
  ],
  "expectations": {
    "mustCallTools": [
      "lookup_knowledge"
    ],
    "mustNotCallTools": [],
    "policyFlags": [],
    "styleFlags": [
      "concise"
    ]
  }
}
