{
  "id": "SCL_Yh7S3cwV3WZo-multiple-matches-turn-2",
  "suite": "verification",
  "source": "livekit-trace",
  "traceId": "SCL_Yh7S3cwV3WZo",
  "tags": [
    "verification",
    "multiple-matches",
    "hipaa",
    "needs-review"
  ],
  "context": {
    "trunkPhone": "+17275919997",
    "phoneLookupStatus": "multiple_matches",
    "notes": "Extracted from a multiple-match phone lookup flow."
  },
  "conversation": [
    {
      "role": "assistant",
      "content": "thank you for calling Abita Eye Group, this is David, how can I help you?"
    },
    {
      "role": "user",
      "content": "Hi, David. Um— I have a— we have a 12 o'clock appointment?"
    }
  ],
  "expectations": {
    "mustCallTools": [],
    "mustNotCallTools": [
      "confirm_appt",
      "get_availability",
      "book_appt"
    ],
    "mustSay": [
      "first name"
    ],
    "mustNotSay": [
      "date of birth",
      "last name"
    ],
    "policyFlags": [
      "do_not_read_back_known_names"
    ],
    "styleFlags": [
      "concise"
    ]
  }
}
