{
  "id": "SCL_AVtp9sqbaXLM-transfer-turn-3",
  "suite": "transfer",
  "source": "livekit-trace",
  "traceId": "SCL_AVtp9sqbaXLM",
  "tags": [
    "transfer",
    "needs-review"
  ],
  "context": {
    "trunkPhone": "+17275919997",
    "phoneLookupStatus": "unknown",
    "notes": "Extracted from a call that transferred to a human."
  },
  "conversation": [
    {
      "role": "assistant",
      "content": "thank you for calling Abita Eye Group, this is David, how can I help you?"
    },
    {
      "role": "user",
      "content": "I need to speak to someone."
    },
    {
      "role": "assistant",
      "content": "would you mind telling me what you're calling about?"
    },
    {
      "role": "user",
      "content": "Checking on surgery date."
    }
  ],
  "expectations": {
    "mustCallTools": [
      "transfer_call"
    ],
    "mustNotCallTools": [],
    "policyFlags": [
      "transfer_required",
      "speak_full_transfer_message_before_call"
    ],
    "styleFlags": []
  }
}
