{
  "id": "SCL_jmridTecERCv-transfer-turn-4",
  "suite": "transfer",
  "source": "livekit-trace",
  "traceId": "SCL_jmridTecERCv",
  "tags": [
    "transfer",
    "needs-review"
  ],
  "context": {
    "trunkPhone": "+17275919997",
    "phoneLookupStatus": "unknown",
    "notes": "Extracted from a call that transferred to a human."
  },
  "conversation": [
    {
      "role": "assistant",
      "content": "thank you for calling Abita Eye Group, this is David, how can I help you?"
    },
    {
      "role": "user",
      "content": "Um,"
    },
    {
      "role": "assistant",
      "content": "no worries, take your time.  What can I do for you today?"
    },
    {
      "role": "user",
      "content": "Receptionist."
    },
    {
      "role": "assistant",
      "content": "yeah, I'm the receptionist here.  What do you need help with?"
    },
    {
      "role": "user",
      "content": "Office, please."
    }
  ],
  "expectations": {
    "mustCallTools": [
      "transfer_call"
    ],
    "mustNotCallTools": [],
    "policyFlags": [
      "transfer_required",
      "speak_full_transfer_message_before_call"
    ],
    "styleFlags": []
  }
}
