{
  "id": "SCL_5jeiC2mbrpaR-quick-question-turn-30",
  "suite": "quick-question",
  "source": "livekit-trace",
  "traceId": "SCL_5jeiC2mbrpaR",
  "tags": [
    "quick-question",
    "knowledge",
    "needs-review"
  ],
  "context": {
    "trunkPhone": "+17275919997",
    "phoneLookupStatus": "unknown",
    "notes": "Real call: agent looked up knowledge for a question. Check answer was grounded in lookup result, not invented."
  },
  "conversation": [
    {
      "role": "assistant",
      "content": "thank you for calling Abita Eye Group, this is David, how can I help you?"
    },
    {
      "role": "user",
      "content": "I have a referral from my primary care—"
    },
    {
      "role": "assistant",
      "content": "ok, have you been"
    },
    {
      "role": "user",
      "content": "Is calling to set up an— No."
    },
    {
      "role": "assistant",
      "content": "alright let me get you set up.  What insurance do you have?"
    },
    {
      "role": "user",
      "content": "And have Oscar Silver Simple— So, uh, Florida?"
    },
    {
      "role": "assistant",
      "content": "yeah we take Oscar Health.  What's your name?"
    },
    {
      "role": "user",
      "content": "Andrea— stone—"
    },
    {
      "role": "assistant",
      "content": "Andrea Stone, and what's your date of birth?"
    },
    {
      "role": "user",
      "content": "12/30/1980."
    },
    {
      "role": "assistant",
      "content": "ok, and what's your phone number?"
    },
    {
      "role": "user",
      "content": "9, 3, 6— 994. 6545?"
    },
    {
      "role": "assistant",
      "content": "got it, and what's your email address?"
    },
    {
      "role": "user",
      "content": "A— N— A— D-R-E-A-M—"
    },
    {
      "role": "assistant",
      "content": "is that at gmail, outlook, or somewhere else?"
    },
    {
      "role": "user",
      "content": "T—"
    },
    {
      "role": "assistant",
      "content": "what comes"
    },
    {
      "role": "user",
      "content": "You— I hadn't finished."
    },
    {
      "role": "assistant",
      "content": "go ahead, finish it."
    },
    {
      "role": "user",
      "content": "anadramstone@gmail.com."
    },
    {
      "role": "assistant",
      "content": "got it. What's your street address?"
    },
    {
      "role": "user",
      "content": "5291— Harbinger Road— Spring Hill, Florida, 34608."
    },
    {
      "role": "assistant",
      "content": "got it, and is that an apartment or suite number?"
    },
    {
      "role": "user",
      "content": "No."
    },
    {
      "role": "assistant",
      "content": "alright, and are you male or female?"
    },
    {
      "role": "user",
      "content": "Email—"
    },
    {
      "role": "assistant",
      "content": "you already gave me your email, I just need to know if you're male or female."
    },
    {
      "role": "user",
      "content": "Email—"
    },
    {
      "role": "assistant",
      "content": "are you male or female?"
    },
    {
      "role": "user",
      "content": "Email."
    },
    {
      "role": "assistant",
      "content": "I have your email already -- anadramstone at gmail dot com.  I just need to know if you're male or female."
    },
    {
      "role": "user",
      "content": "Female— F-E— M-A-L-I— Female."
    },
    {
      "role": "assistant",
      "content": "got it. Now I need the name on your insurance card and the member ID."
    },
    {
      "role": "user",
      "content": "Andreas— down—"
    },
    {
      "role": "assistant",
      "content": "is that the name on the card?"
    },
    {
      "role": "user",
      "content": "Yes."
    },
    {
      "role": "assistant",
      "content": "alright, and what's the member ID number?"
    },
    {
      "role": "user",
      "content": "0S— C— — 781-225-4101."
    },
    {
      "role": "assistant",
      "content": "alright let me confirm -- I have Andrea Stone, S-T-O-N-E, date of birth December thirtieth nineteen eighty, Oscar Health, member ID zero S C seven eight one two two five four one zero one.  That all right?"
    },
    {
      "role": "user",
      "content": "I'd say I think it's probably— Oh— SC 781-225-4101."
    },
    {
      "role": "assistant",
      "content": "so just S C seven eight one two two five four one zero one?  No zero at the start?"
    },
    {
      "role": "user",
      "content": "No, it's an O at the start. Oscar O—"
    },
    {
      "role": "assistant",
      "content": "got it, so O S C seven eight one two two five four one zero one.  That all right?"
    },
    {
      "role": "user",
      "content": "Yes."
    },
    {
      "role": "assistant",
      "content": "perfect, you're all set.  So what's the reason for your visit?"
    },
    {
      "role": "user",
      "content": "Uh, diabetic—"
    },
    {
      "role": "assistant",
      "content": "ok, and what day works for you?"
    },
    {
      "role": "user",
      "content": "Any—"
    },
    {
      "role": "assistant",
      "content": "I've got Tuesday April twenty-first.  How's nine fifteen a m with Dr. Licht?"
    },
    {
      "role": "user",
      "content": "That is— Wonderful. Can you repeat that for me, though?"
    },
    {
      "role": "assistant",
      "content": "Tuesday April twenty-first at nine fifteen a m with Dr. Licht at Spring Hill.  Should I book that?"
    },
    {
      "role": "user",
      "content": "Yes, but that was 9— what?"
    },
    {
      "role": "assistant",
      "content": "nine fifteen a m. Should I go ahead and book"
    },
    {
      "role": "user",
      "content": "Thank you, Kim—"
    },
    {
      "role": "assistant",
      "content": "you're all set. Tuesday April twenty-first at nine fifteen a m with Dr. Licht at Spring Hill.  Is there anything else I can help with?"
    },
    {
      "role": "user",
      "content": "Um— That— Address is—"
    },
    {
      "role": "assistant",
      "content": "Abita Eye Group Spring Hill.  Do you need the full address?"
    },
    {
      "role": "user",
      "content": "Yes."
    }
  ],
  "expectations": {
    "mustCallTools": [
      "lookup_knowledge"
    ],
    "mustNotCallTools": [],
    "policyFlags": [],
    "styleFlags": [
      "concise"
    ]
  }
}
