{
  "id": "SCL_6uxKtiZuFhv4-transfer-turn-3",
  "suite": "transfer",
  "source": "livekit-trace",
  "traceId": "SCL_6uxKtiZuFhv4",
  "tags": [
    "transfer",
    "needs-review"
  ],
  "context": {
    "trunkPhone": "+13523202007",
    "phoneLookupStatus": "unknown",
    "notes": "Extracted from a call that transferred to a human."
  },
  "conversation": [
    {
      "role": "assistant",
      "content": "Thank you for calling Eye Radiance powered by Abeeta Eye Group. How can I help you?"
    },
    {
      "role": "user",
      "content": "Hey, is this Joe?"
    },
    {
      "role": "assistant",
      "content": "No, this is David at the front desk.  How can I help you today?"
    },
    {
      "role": "user",
      "content": "Hello? Oh, I'm sorry. Hi, I'm calling, um, I had a, uh, an exam by Dr. Lick and he had put it through my insurance for the eye surgery and I got a denial, so I don't know where we go from there."
    }
  ],
  "expectations": {
    "mustCallTools": [
      "transfer_call"
    ],
    "mustNotCallTools": [],
    "policyFlags": [
      "transfer_required",
      "speak_full_transfer_message_before_call"
    ],
    "styleFlags": []
  }
}
